
0039352,KRISHIVED PFM,pragatia,,normal,minor,always,,Bug,2022-02-14,,,,public,2022-02-18,"Language selected is English but on edit trading session master screen,success messages are getting displayed in Hindi on updat",deployed_in_uat,open,
0039387,KRISHIVED PFM,yasht,shradha,high,major,always,,Bug,2022-02-15,,,,public,2022-02-16,Data is not getting displayed for user YST1 in organisation self registration approval screen .,deployed_in_uat,open,
0039400,KRISHIVED PFM,pragatia,saurabhd,normal,minor,always,,Bug,2022-02-16,,,,public,2022-02-16,Unable to define trading session.,deployed_in_uat,open,
0039381,KRISHIVED PFM,pragatia,,normal,minor,always,,Bug,2022-02-15,,,,public,2022-02-16,"Language label input - User does not receive any alert message for language 1 should be English, language 2 should be Hindi , la",deployed_in_uat,open,
0039363,KRISHIVED PFM,pragatia,,normal,minor,always,,Bug,2022-02-14,,,,public,2022-02-16,"After updating the bank details from view client screen, the data did not update in account master. TMID - 1401295",deployed_in_uat,open,
0039362,KRISHIVED PFM,pragatia,,normal,minor,always,,Bug,2022-02-14,,,,public,2022-02-15,Language label input - Language label added for commodities but it was not getting updated in HINDI on view commodity master sc,deployed_in_uat,open,
0039358,KRISHIVED PFM,pragatia,,normal,minor,always,,Bug,2022-02-14,,,,public,2022-02-15,Edit trading account : trading account details get updated successfully even when mandatory fields in bank details are kept emp,deployed_in_uat,open,
0039357,KRISHIVED PFM,pragatia,,normal,minor,always,,Bug,2022-02-14,,,,public,2022-02-15,"Trading account approval : On approve by admin, no message is getting displayed and approve button gets disabled .",deployed_in_uat,open,
0039356,KRISHIVED PFM,pragatia,,normal,minor,always,,Bug,2022-02-14,,,,public,2022-02-15,"View tac : in bank details tab, if IFSC code is entered wrong and click on update button then error msg is not getting displaye",deployed_in_uat,open,
0039354,KRISHIVED PFM,pragatia,,normal,minor,always,,Bug,2022-02-14,,,,public,2022-02-15,"View tac : in bank details tab,bank acciunt no,acc holer name are entered incorrect then also tac got saved successfully",deployed_in_uat,open,
0039353,KRISHIVED PFM,pragatia,,normal,minor,always,,Bug,2022-02-14,,,,public,2022-02-15,"Create trading account screen - In bank details, entered incorrect IFSC code and bank account no then also TAC saved successfull",deployed_in_uat,open,
0039103,KRISHIVED posttrade,yasht,,normal,minor,always,,Bug,2022-02-07,,,,public,2022-02-07,While buyer payin margin to be released shows 1 even after setting buyer side margin as 0 .,deployed_in_uat,open,
0039048,KRISHIVED posttrade,yasht,,normal,minor,always,,Bug,2022-02-04,,,,public,2022-02-04,Buyer payin process stucked in completed stage even after depositing required shortage amount .,deployed_in_uat,open,
0039047,KRISHIVED posttrade,yasht,,normal,minor,always,,Bug,2022-02-04,,,,public,2022-02-04,Margin book and margin block release book shows market code as NA in grid . it should be ledger code instead of market code .,deployed_in_uat,open,
0036470,KRISHIVED PFM,asham,ashwinir,normal,minor,always,,Bug,2021-11-11,,,,public,2021-11-11,Export to excel is not provided for add relationship manager screen.,deployed_in_uat,open,
0036469,KRISHIVED PFM,asham,ashwinir,normal,major,always,,Bug,2021-11-11,,,,public,2021-11-11,"Unable to delete the relationship manager entry from the master screen,nothing is happened after click on delete button",deployed_in_uat,open,
0036468,KRISHIVED PFM,asham,ashwinir,normal,minor,always,,Bug,2021-11-11,,,,public,2021-11-11,Masters---Add Relationship Manager screen allowed to add the same relationship manager multiple times.,deployed_in_uat,open,
0035901,KRISHIVED PFM,asham,ashwinir,normal,minor,always,,Bug,2021-10-23,,,,public,2021-10-25,PFM--Contract token parameter-- If the parameter type kep as simple list then % is not allowed while adding the parameter value.,deployed_in_uat,open,
